{
  "protocol": "trqp",
  "protocol_version": "3.0-candidate",
  "binding": "tsp",
  "message_type": "response",
  "message_id": "urn:uuid:22222222-2222-4222-8222-222222222222",
  "in_reply_to": "urn:uuid:11111111-1111-4111-8111-111111111111",
  "body": {
    "decision": "positive",
    "reason": "evidence-supports-proposition",
    "authorized": true,
    "recognized": false,
    "evaluation_time": "2026-09-17T14:30:00Z",
    "evidence_state": "sufficient",
    "evidence": []
  }
}
