{
  "protocol": "trqp",
  "protocol_version": "3.0-candidate",
  "binding": "tsp",
  "message_type": "query",
  "message_id": "urn:uuid:11111111-1111-4111-8111-111111111111",
  "body": {
    "trqp_version": "3.0-candidate",
    "entity_id": "did:example:subject",
    "authority_id": "did:example:registry-authority",
    "action": "issue",
    "resource": "urn:example:credential-type:foo",
    "critical_context": ["requester_vid", "verification_material"],
    "context": {
      "requester_vid": "did:example:tsp-requester",
      "verification_material": "did:example:subject#key-2"
    },
    "required_profiles": []
  }
}
